{
  "schemaVersion": 1,
  "documentType": "component-profile",
  "id": "lean-daw-defender-retained",
  "name": "Lean DAW (Defender retained)",
  "description": "Applies the Lean DAW removals and protections while retaining Microsoft Defender until a supported Windows 11 client removal path exists.",
  "actions": {
    "windows-search": "disable",
    "bing-search": "disable",
    "widgets-webexperience": "remove",
    "copilot": "remove",
    "feedback-hub": "remove",
    "defender": "keep",
    "smartscreen": "disable",
    "uac-prompt-suppression": "keep",
    "uac": "disable",
    "windows-ai": "remove",
    "onedrive": "remove",
    "xbox-gaming": "remove",
    "consumer-appx": "remove",
    "telemetry-consumer-content": "disable",
    "nfs": "protected",
    "modern-shell": "protected",
    "client-cbs": "protected",
    "microsoft-store-infrastructure": "protected",
    "desktop-app-installer": "protected",
    "windows-terminal": "protected",
    "webview2": "protected",
    "windows-app-runtime": "protected",
    "ui-xaml": "protected",
    "vclibs": "protected",
    "wsl": "protected",
    "virtual-machine-platform": "protected",
    "hyper-v-payloads": "protected",
    "windows-error-reporting": "protected",
    "app-compatibility": "protected",
    "sysmain-prefetch": "protected",
    "feature-delivery": "protected",
    "featureconfig-onesettings": "protected",
    "cpu-mitigations": "protected",
    "windows-servicing-tasks": "protected",
    "component-store": "protected",
    "rollback-state": "protected",
    "windows-update": "protected",
    "reversible-component-cleanup": "protected",
    "openssh-client": "protected",
    "openssh-server": "protected"
  }
}
