{
  "schemaVersion": 1,
  "documentType": "component-profile",
  "id": "default-winutil",
  "name": "Default WinUtil",
  "description": "Preserves current Win11 Creator behavior by making no deep component removals or disables.",
  "actions": {
    "windows-search": "keep",
    "bing-search": "keep",
    "widgets-webexperience": "keep",
    "copilot": "keep",
    "feedback-hub": "keep",
    "defender": "keep",
    "smartscreen": "keep",
    "uac": "keep",
    "windows-ai": "keep",
    "onedrive": "keep",
    "xbox-gaming": "keep",
    "consumer-appx": "keep",
    "telemetry-consumer-content": "keep",
    "nfs": "keep",
    "modern-shell": "protected",
    "client-cbs": "protected",
    "microsoft-store-infrastructure": "protected",
    "desktop-app-installer": "protected",
    "windows-terminal": "protected",
    "webview2": "protected",
    "windows-app-runtime": "protected",
    "ui-xaml": "protected",
    "vclibs": "protected",
    "wsl": "protected",
    "virtual-machine-platform": "protected",
    "hyper-v-payloads": "protected",
    "windows-error-reporting": "protected",
    "app-compatibility": "protected",
    "sysmain-prefetch": "protected",
    "feature-delivery": "protected",
    "featureconfig-onesettings": "protected",
    "cpu-mitigations": "protected",
    "windows-servicing-tasks": "protected",
    "component-store": "protected",
    "rollback-state": "protected",
    "windows-update": "protected",
    "reversible-component-cleanup": "protected",
    "openssh-client": "keep",
    "openssh-server": "keep"
  }
}
